{
  "$id": "urn:agent-hook-kit:contracts:gemini-cli:commit-f354eeb-r2:notification:input",
  "$schema": "https://json-schema.org/draft/2020-12/schema",
  "additionalProperties": true,
  "properties": {
    "cwd": {
      "type": "string"
    },
    "details": {
      "type": "object"
    },
    "hook_event_name": {
      "const": "Notification"
    },
    "message": {
      "type": "string"
    },
    "notification_type": {
      "type": "string"
    },
    "session_id": {
      "type": "string"
    },
    "timestamp": {
      "type": "string"
    },
    "transcript_path": {
      "type": "string"
    }
  },
  "required": [
    "session_id",
    "transcript_path",
    "cwd",
    "hook_event_name",
    "timestamp",
    "notification_type",
    "message",
    "details"
  ],
  "type": "object"
}
