{
  "session_id": "gemini-sess-001",
  "transcript_path": "/tmp/gemini/transcript-001.json",
  "cwd": "/home/user/project",
  "hook_event_name": "Notification",
  "timestamp": "2026-07-12T00:00:00Z",
  "notification_type": "ToolPermission",
  "message": "Permission required",
  "details": {"tool": "run_shell_command"}
}
